question_id,question_text,priority,pattern_id,pattern_name,solving_formula,notes
678,Design the recommendation engine for Amazon's homepage.,🟡,L14,System Design (Conceptual),Components → Data Flow → Boundaries → Scale Considerations,System design; recommendation engine
679,Design the SMS API for Twilio.,🟡,L14,System Design (Conceptual),Components → Data Flow → Boundaries → Scale Considerations,System design; API design
680,Design the system for a ticket selling web application.,🟡,L14,System Design (Conceptual),Components → Data Flow → Boundaries → Scale Considerations,System design; ticketing system
681,Design Ticketmaster,🟡,L14,System Design (Conceptual),Components → Data Flow → Boundaries → Scale Considerations,System design; ticketing platform
683,Design Twitch or any live streaming platform.,🟡,L14,System Design (Conceptual),Components → Data Flow → Boundaries → Scale Considerations,System design; live streaming
684,Design Twitter.,🟡,L14,System Design (Conceptual),Components → Data Flow → Boundaries → Scale Considerations,System design; social platform
685,Design type-ahead search for walmart.com.,🟡,L14,System Design (Conceptual),Components → Data Flow → Boundaries → Scale Considerations,System design; search autocomplete
686,Design typeahead autocomplete for person search in Linkedin.,🟡,L14,System Design (Conceptual),Components → Data Flow → Boundaries → Scale Considerations,System design; search autocomplete
687,Design Uber Eats.,🟡,L14,System Design (Conceptual),Components → Data Flow → Boundaries → Scale Considerations,System design; food delivery
693,Detect the language of a text input.,🟡,L14,System Design (Conceptual),Components → Data Flow → Boundaries → Scale Considerations,System design; NLP
722,Discuss version control on Google Docs.,🟡,L14,System Design (Conceptual),Components → Data Flow → Boundaries → Scale Considerations,System explanation; version control
724,Display job postings to users in the same city based on their previous searches.,🟡,L14,System Design (Conceptual),Components → Data Flow → Boundaries → Scale Considerations,System design; job matching
732,"Draw the system for which one of your programs was responsible. Discuss the different components, how they interact, and the technical decisions made.",🟡,L14,System Design (Conceptual),Components → Data Flow → Boundaries → Scale Considerations,System explanation; behavioral question
781,Explain a typical computer vision pipeline.,🟡,L14,System Design (Conceptual),Components → Data Flow → Boundaries → Scale Considerations,System explanation; ML pipeline
797,Explain how microservices work.,🟡,L14,System Design (Conceptual),Components → Data Flow → Boundaries → Scale Considerations,System explanation; architecture
798,Explain how RAG works.,🟡,L14,System Design (Conceptual),Components → Data Flow → Boundaries → Scale Considerations,System explanation; AI architecture
801,Explain how to train and deploy an ML model for license plate detection for customer pick-up orders at a retail store. How do you decide between on-premise versus cloud deployment?,🟡,L14,System Design (Conceptual),Components → Data Flow → Boundaries → Scale Considerations,ML deployment decision; system design
805,"Explain how you would design Google Play Store, including your choice of database, its structure, and rationale.",🟡,L14,System Design (Conceptual),Components → Data Flow → Boundaries → Scale Considerations,System design; database architecture
807,Explain in detail the architecture of the platform you're working on.,🟡,L14,System Design (Conceptual),Components → Data Flow → Boundaries → Scale Considerations,System explanation; behavioral question
827,Explain the differences between Parquet and Avro.,🟡,L14,System Design (Conceptual),Components → Data Flow → Boundaries → Scale Considerations,Data format explanation; system design
830,Explain the differences between wide and narrow dependencies in Apache Spark.,🟡,L14,System Design (Conceptual),Components → Data Flow → Boundaries → Scale Considerations,System explanation; Spark architecture
836,Explain the process of a Google Search.,🟡,L14,System Design (Conceptual),Components → Data Flow → Boundaries → Scale Considerations,System explanation; search architecture
847,Explain your product's technical stacks and the associated trade-offs.,🟡,L14,System Design (Conceptual),Components → Data Flow → Boundaries → Scale Considerations,Technical explanation; tradeoff analysis
921,"Given a large set of CSV files with thousands of paragraphs each, how would you detect duplicates within each file, and how would you scale this solution for many files?",🟡,L14,System Design (Conceptual),Components → Data Flow → Boundaries → Scale Considerations,Duplicate detection; system design
977,"Given that AWS Glue is underperforming, what other ETL tools would you consider using to handle unstructured data in the data warehouse?",🟡,L14,System Design (Conceptual),Components → Data Flow → Boundaries → Scale Considerations,ETL tool selection; system design
991,Go into detail about a login endpoint.,🟡,L14,System Design (Conceptual),Components → Data Flow → Boundaries → Scale Considerations,API design; system design
996,Google wants to award its 5 trillionth query with a prize. How would you design this solution?,🟡,L14,System Design (Conceptual),Components → Data Flow → Boundaries → Scale Considerations,System design; milestone tracking
1024,How can Stripe use data to predict the optimal time to retry a transaction?,🟡,L14,System Design (Conceptual),Components → Data Flow → Boundaries → Scale Considerations,Predictive system; transaction retry
1038,How do Amazon price tracker tools like Aarabuy work?,🟡,L14,System Design (Conceptual),Components → Data Flow → Boundaries → Scale Considerations,System explanation; price tracking
1046,How do you approach building prototypes using AI tools versus traditional coding?,🟡,L14,System Design (Conceptual),Components → Data Flow → Boundaries → Scale Considerations,Prototyping approach; system design
1074,"How do you decide whether a problem should be solved using AI, generative AI, an agent-based system, traditional programming, or just a simple rule-based approach?",🟡,L14,System Design (Conceptual),Components → Data Flow → Boundaries → Scale Considerations,Solution selection; system design
1095,How do you evaluate a Gen AI system?,🟡,L14,System Design (Conceptual),Components → Data Flow → Boundaries → Scale Considerations,AI evaluation; system design
1164,How does an HTTP request work?,🟡,L14,System Design (Conceptual),Components → Data Flow → Boundaries → Scale Considerations,System explanation; networking
1166,How does Google Maps compute ETA?,🟡,L14,System Design (Conceptual),Components → Data Flow → Boundaries → Scale Considerations,System explanation; ETA calculation
1167,How does Nvidia employ machine learning?,🟡,L14,System Design (Conceptual),Components → Data Flow → Boundaries → Scale Considerations,System explanation; ML applications
1227,"How will you address your API limits? Describe all possible scenarios regarding customers, technology, and suppliers.",🟡,L14,System Design (Conceptual),Components → Data Flow → Boundaries → Scale Considerations,API limits; system design
1262,How would you build a recommendation system for an e-commerce store?,🟡,L14,System Design (Conceptual),Components → Data Flow → Boundaries → Scale Considerations,Recommendation system; system design
1264,How would you build a system for running experiments such as A/B tests on an app or website?,🟡,L14,System Design (Conceptual),Components → Data Flow → Boundaries → Scale Considerations,A/B testing system; system design
1265,How would you build a tool that verifies customer identities?,🟡,L14,System Design (Conceptual),Components → Data Flow → Boundaries → Scale Considerations,Identity verification; system design
1266,How would you build a tool to authenticate products sold on TikTok Shop?,🟡,L14,System Design (Conceptual),Components → Data Flow → Boundaries → Scale Considerations,Product authentication; system design
1272,How would you build TinyURL?,🟡,L14,System Design (Conceptual),Components → Data Flow → Boundaries → Scale Considerations,URL shortener; system design
1274,How would you choose a programming language to build your product at Google?,🟡,L14,System Design (Conceptual),Components → Data Flow → Boundaries → Scale Considerations,Technology choice; system design
1305,How would you design a system for a healthcare agent that summarizes a patient's medical history?,🟡,L14,System Design (Conceptual),Components → Data Flow → Boundaries → Scale Considerations,Healthcare system; system design
1451,How would you improve YouTube's recommendation algorithm?,🟡,L14,System Design (Conceptual),Components → Data Flow → Boundaries → Scale Considerations,Recommendation algorithm; system design
1469,"How would you integrate an email marketing tool with a CRM like Salesforce, HubSpot, or Zoho?",🟡,L14,System Design (Conceptual),Components → Data Flow → Boundaries → Scale Considerations,Integration design; system design
1470,How would you integrate LinkedIn with Cisco Webex to display user profiles on Webex during meetings?,🟡,L14,System Design (Conceptual),Components → Data Flow → Boundaries → Scale Considerations,Integration design; system design
1483,How would you make the internet faster?,🟡,L14,System Design (Conceptual),Components → Data Flow → Boundaries → Scale Considerations,Infrastructure improvement; system design
1557,How would you scale the design of a messaging system that only involves emojis for users in Europe and US? How would you identify the origin of traffic?,🟡,L14,System Design (Conceptual),Components → Data Flow → Boundaries → Scale Considerations,Messaging system; system design
1715,List 3 endpoints on theScore app.,🟡,L14,System Design (Conceptual),Components → Data Flow → Boundaries → Scale Considerations,API endpoints; system design
1716,List an example of one endpoint on Twitch.,🟡,L14,System Design (Conceptual),Components → Data Flow → Boundaries → Scale Considerations,API endpoints; system design
1717,List five different APIs offered by Spotify.,🟡,L14,System Design (Conceptual),Components → Data Flow → Boundaries → Scale Considerations,API endpoints; system design
1718,List four endpoints on Tinder.,🟡,L14,System Design (Conceptual),Components → Data Flow → Boundaries → Scale Considerations,API endpoints; system design
1721,List three endpoints on edX.,🟡,L14,System Design (Conceptual),Components → Data Flow → Boundaries → Scale Considerations,API endpoints; system design
1722,List three endpoints on Top Hat.,🟡,L14,System Design (Conceptual),Components → Data Flow → Boundaries → Scale Considerations,API endpoints; system design
1782,Question related to data architecture.,🟡,L14,System Design (Conceptual),Components → Data Flow → Boundaries → Scale Considerations,Data architecture; system design
1842,SQL Stored Procedures,🟡,L14,System Design (Conceptual),Components → Data Flow → Boundaries → Scale Considerations,SQL procedures; system design
1849,System Design: Design an AirTag system.,🟡,L14,System Design (Conceptual),Components → Data Flow → Boundaries → Scale Considerations,AirTag system; system design
1886,Tell me about a system you are currently working on.,🟡,L14,System Design (Conceptual),Components → Data Flow → Boundaries → Scale Considerations,System description; system design
2008,Tell me about a time when you were involved in system architecture. What components were involved and what was your role?,🟡,L14,System Design (Conceptual),Components → Data Flow → Boundaries → Scale Considerations,System architecture; behavioral question
2109,Tell me about the design and architecture of the program you managed. Explain the system end-to-end and various technologies you picked with reason.,🟡,L14,System Design (Conceptual),Components → Data Flow → Boundaries → Scale Considerations,System architecture; behavioral question
2185,Walk me through the technical architecture of your product.,🟡,L14,System Design (Conceptual),Components → Data Flow → Boundaries → Scale Considerations,Technical architecture; system design
2201,What are some endpoints on Amazon.com?,🟡,L14,System Design (Conceptual),Components → Data Flow → Boundaries → Scale Considerations,API endpoints; system design
2202,What are some endpoints Robinhood has?,🟡,L14,System Design (Conceptual),Components → Data Flow → Boundaries → Scale Considerations,API endpoints; system design
2205,What are the advantages and disadvantages of GraphQL?,🟡,L14,System Design (Conceptual),Components → Data Flow → Boundaries → Scale Considerations,GraphQL; system design
2221,What are the key technical elements and considerations required to develop a push notification system for an app?,🟡,L14,System Design (Conceptual),Components → Data Flow → Boundaries → Scale Considerations,Push notifications; system design
2236,What are three APIs on theScore's mobile app?,🟡,L14,System Design (Conceptual),Components → Data Flow → Boundaries → Scale Considerations,API endpoints; system design
2238,What are three endpoints on Discord?,🟡,L14,System Design (Conceptual),Components → Data Flow → Boundaries → Scale Considerations,API endpoints; system design
2239,What are three endpoints on Wayfair?,🟡,L14,System Design (Conceptual),Components → Data Flow → Boundaries → Scale Considerations,API endpoints; system design
2240,What are three endpoints on YouTube?,🟡,L14,System Design (Conceptual),Components → Data Flow → Boundaries → Scale Considerations,API endpoints; system design
2279,What does the Signup endpoint on Facebook do?,🟡,L14,System Design (Conceptual),Components → Data Flow → Boundaries → Scale Considerations,API endpoint; system design
2288,What factors do you consider when trying to integrate two different products or platforms?,🟡,L14,System Design (Conceptual),Components → Data Flow → Boundaries → Scale Considerations,Integration; system design
2303,What happens when you navigate to a website?,🟡,L14,System Design (Conceptual),Components → Data Flow → Boundaries → Scale Considerations,Web navigation; system design
2304,"What happens, technically, when someone does a Google Search?",🟡,L14,System Design (Conceptual),Components → Data Flow → Boundaries → Scale Considerations,Search system; system design
2310,What is a Medallion Architecture?,🟡,L14,System Design (Conceptual),Components → Data Flow → Boundaries → Scale Considerations,Data architecture; system design
2316,What is an API and how does it work?,🟡,L14,System Design (Conceptual),Components → Data Flow → Boundaries → Scale Considerations,API explanation; system design
2319,What is cloud gaming?,🟡,L14,System Design (Conceptual),Components → Data Flow → Boundaries → Scale Considerations,Cloud gaming; system design
2320,What is delta lake?,🟡,L14,System Design (Conceptual),Components → Data Flow → Boundaries → Scale Considerations,Data architecture; system design
2321,What is DevOps?,🟡,L14,System Design (Conceptual),Components → Data Flow → Boundaries → Scale Considerations,DevOps; system design
2328,What is the best way to connect SQL databases and why?,🟡,L14,System Design (Conceptual),Components → Data Flow → Boundaries → Scale Considerations,Database connection; system design
2331,What is the difference between a POST request and a GET request?,🟡,L14,System Design (Conceptual),Components → Data Flow → Boundaries → Scale Considerations,HTTP methods; system design
2333,What is the difference between authentication and authorization?,🟡,L14,System Design (Conceptual),Components → Data Flow → Boundaries → Scale Considerations,Security concepts; system design
2336,What is the difference between NoSQL and SQL?,🟡,L14,System Design (Conceptual),Components → Data Flow → Boundaries → Scale Considerations,Database comparison; system design
2337,What is the difference between OLTP and OLAP?,🟡,L14,System Design (Conceptual),Components → Data Flow → Boundaries → Scale Considerations,Database architecture; system design
2445,What technical components are needed to implement spending limits for virtual debit cards?,🟡,L14,System Design (Conceptual),Components → Data Flow → Boundaries → Scale Considerations,Technical components; system design
2447,What technical elements are involved in implementing a per-transaction limit for the virtual card feature?,🟡,L14,System Design (Conceptual),Components → Data Flow → Boundaries → Scale Considerations,Technical elements; system design
2457,What types of indexes are in a relational database?,🟡,L14,System Design (Conceptual),Components → Data Flow → Boundaries → Scale Considerations,Database indexes; system design
2486,What's the difference between a data lakehouse and a data warehouse?,🟡,L14,System Design (Conceptual),Components → Data Flow → Boundaries → Scale Considerations,Data architecture; system design
2487,What's the difference between an API and an SDK?,🟡,L14,System Design (Conceptual),Components → Data Flow → Boundaries → Scale Considerations,API vs SDK; system design
2516,What's the difference between the Kubernetes control plane and data plane?,🟡,L14,System Design (Conceptual),Components → Data Flow → Boundaries → Scale Considerations,Kubernetes; system design
2518,"When building an app for millions of users, would you deploy the ML model on the server side or client side?",🟡,L14,System Design (Conceptual),Components → Data Flow → Boundaries → Scale Considerations,ML deployment; system design
2519,"When designing a chat application, how would you decide between using SQL and NoSQL databases?",🟡,L14,System Design (Conceptual),Components → Data Flow → Boundaries → Scale Considerations,Database choice; system design
2525,When should you use a job cluster instead of an all-purpose cluster?,🟡,L14,System Design (Conceptual),Components → Data Flow → Boundaries → Scale Considerations,Cluster choice; system design
2526,When should you use Delta Live Tables over standard data pipelines built on Spark and Delta Lake?,🟡,L14,System Design (Conceptual),Components → Data Flow → Boundaries → Scale Considerations,Data pipeline choice; system design
2626,Why use a message queue?,🟡,L14,System Design (Conceptual),Components → Data Flow → Boundaries → Scale Considerations,System design; conceptual question
2663,You are a product manager at Facebook working on the news feed. Design a system to determine if Facebook should display an ad or a friend recommendation after every 20 posts in the feed for the users.,🟡,L14,System Design (Conceptual),Components → Data Flow → Boundaries → Scale Considerations,System design; conceptual question
2678,"You are the lead for recommending notifications to an existing news app. Describe how the product works, the technologies used, how the system decides what notifications to send, and how you would ...",🟡,L14,System Design (Conceptual),Components → Data Flow → Boundaries → Scale Considerations,System design; conceptual question
